許載は「大きな試合をたくさん経験したため、危機突破と機会活用には自信がある」と話した。	许财说：“因为经历过很多次大赛，我很有自信突破危机度过难关。”
普段あまり褒めないことで有名な三星の金応竜（キム・ウンリョン）監督も、同試合が終った後、「クォン・ヒョクが本当に良く投げてくれた」と、親指を立てたほど。	平时不爱夸人的三星队教练金应龙在比赛结束后称赞说：“权赫投得太好了。”
チームはベスト８で脱落したものの、イム・テフンは鋭いストライクと切れのよい変化球で、プロ野球のスカウトの注目を受けた。	虽然球队在八强赛中被淘汰出局，但任泰勋凭借刁钻的直线球和让人眼花缭乱的变化球，受到职业棒球球探们的关注。
ほれは，何人くらいなんです？	凑一个球队要多少人啊
観客席で試合を見守っていたレーハーゲル監督は、韓国取材チームからの殺到する質問に対し、含みのある笑みだけを残し、ノーコメントのまま席を離れた。	一直在观众席观看比赛的雷哈格尔，在赛后面对韩国媒体的提问时未进行任何表态，只是留下了意味深长的微笑，随后便静静离场。
ここ３年間で優勝２回、準優勝１回。	近三年时间，他3次进入决赛并有2次夺冠，取得了优秀的成绩。
ちょっぴりくすぶってるけど，フィギュアスケート特別強化選手さ	虽然现在有点宅，却是个货真价实的花滑选手
代表引退のチャ・ドゥリ、オールスター戦ファン投票で１位	车杜里在K联赛全明星赛的球迷投票中位居第一
２ヵ月前、ボーイフレンドに連れられて初めて球場へ来てみたというチョ・ヒジン（２４）さんも、「野球がこんなに迫力あふれるゲームだとは知らなかった。	两个月前第一次与男友一起到现场观看比赛的曹熙珍（24岁）也说：“没想到棒球比赛这么紧张刺激。
どうせなら 最高の状態で勝負してえし…	既然要比赛 当然要以最佳状态上场…
パスを出し，得点に繋げた，	选择传球，让队友得分
先頭に１打差遅れた４位タイで３ラウンドを開始したイ・ミヒャンは、同日、３打を減らし、最終合計１１アンダーパー・２０５打で、ラウンドを終え、同打を記録したイ・イルヒや香妻と延長戦に突入した。	在第一回合落后1杆后，以共同第4名的成绩开始第三回合的李美香当天缩减了3杆，以11低于标准杆、205个击球的成绩结束比赛，与同样成绩的李日熙、小褄琴乃进入到了延长赛。
これは０２年当時ヒディンク監督も使った選手団統制法の一つ。	这是2002年韩日世界杯时担任主教练的希丁克曾使用过的控制选手的方法之一。
サッカーに例えれば、バックパスとサイドパスだけに依存した自殺ゴール直前のレベルだ」と皮肉った。	如果比喻成足球，就是依赖于直传和横传的乌龙球之前的水准。”
シニア舞台のデビュー戦に取り組んだ金ヒョンジョンの顔もあまり明るくなかった。	首次出席成人花样滑冰舞台的金贤贞的表演情况也并不乐观。
今日は　TGC本番ですから	今天就是TGC的正式比赛了
辛文善（シン・ムンソン）ＳＢＳ解説委員抜群のポジショニングと決定力において、朴主永が韓国最高のキラーであるということに異議を唱える人はいないだろう。	SBS电视台解说员辛文善=出色的位置感觉能力和进球能力上，朴周永是当之无愧的韩国最佳前锋，应该没有人会对此表示异议。
でも日向は余裕でここまで跳ぶだろ さっきの試合で見た	不过你随便一跳就能有这么高吧 刚刚比赛的时候我看到了
勝って当然，優勝以外はすべて失敗	胜利是理所应当，得不到冠军就是失败
どうせ　選手だって　うまいやつばっか集めてんだろ	反正 你们尽是招一些优秀的人做选手吧
また孫興民は、大韓サッカー協会とトッテナムとの話し合いを通じて、代表チームの１１月の国際Ａマッチには招集しないため、クラブの試合だけに集中することができる。	另外，孙兴慜根据大韩足球协会和托特纳姆热刺队之间的协议，将不会代表国家队参加11月的A级比赛，只集中于所属球队的比赛。
当時決勝でファン・オクシルは終始先頭を走り、北朝鮮に史上初の金メダルをもたらすかのように見えたが、最後の１周を残してコーナーでバランスを崩し、３位に入った。	在当时的决赛中，黄玉实一直在领跑，似乎有望拿下北韩历史上第一枚冬奥会金牌，但在最后一圈的拐角处失去平衡，一个踉跄被对手超越屈居第3位。
今回の五輪で譲れない対決を控えている両選手が同日、競技場で初めて顔を合わせた。	两名选手将在此次比赛展开一番角逐，她们当天在竞技场上碰了面。
な…なんで私が選手登録されてるの	为…为什么我会被登记成选手啊
フィギュアスケートグランプリファイナル　今夜世界一が決まる	花滑大奖赛总决赛 今晚将角逐世界第一的宝座
一方の李サンミンは、「我々の強みは大きい大会ので試合経験が豊かで、組織力が強いことだ」と話し、勝利を確信している。	李相旼则表示：“我们的优点是大赛经验较多，组织能力较强。”
それを差し引いても，ブロックもフロアもよく見えてるよね	但就算没有10号，小龙也把拦网球员和队员站位看得很清楚
赤木君のリーダーシップは すごかった	赤木的领导凝聚着整支球队的力量
翔陽と陵南の選手たちの息が，合ってきたわね，	陵南跟翔阳的选手，已经渐渐培养出默契来了
くっそ，どうすれば，この試合に出ることができる	可恶，到底要怎么样才能上场
韓国は２３日、大会３連覇を狙う世界最強の中国を相手に、０２年釜山（プサン）大会以降１２年ぶりの金メダル獲得に挑む。	9月23日韩国将迎战志在多得亚运会三连冠的世界最强中国队，挑战2002年釜山亚运会12年之后再次夺冠的梦想。
シューティング・ガードのピョン・ヨンハは２点シュートの成功率（２５％）より高い５５％の３点シュート成功率を記録し、危機の度に貴重なシュートを成功させチームを救った。	与二分球成功率（25%）相比，“投篮专家”边莲荷投出了高水平（55%）的三分球成功率。
韓国選手はこの点を把握して積極的に推し進める作戦を駆使すべきだ。	韩国选手应该了解到这一点，并展开积极进攻的作战方式。
１月行われた１軍とＢチームの評価戦でマイケル・オーウェンと一緒に１軍ツートップをやったが、Ｂチームだったハビエル・ポルティージョ（２２）に押されて１軍行きが挫折した。	虽然在1月举行的一线球队和B队的热身赛上，曾经和迈克尔·欧文一起站在了前锋线上，但是被B队出身的波尔蒂略（22岁）挤掉而没能进入一线队。
バスケ勝負の相手がよりによって	而现在的篮球比赛对手
決勝リーグでも 活躍してほしいけど	希望他在决赛的时候 也能够大展身手
わッ，私が優勝したら	如，如果我取得优胜的话
フリースロー，	投罚球，
大韓サッカー協会の関係者は、「現場で監督を務めていた金専務がオリンピック代表チームの監督という大役を辞退したのは、並大抵のことではない」と評価した。	大韩足协的有关高层人员评价道：“作为现场指挥者的金理事，能够果断放弃奥运会代表队主教的职位，是很了不起的决定。”
今大会で韓国と対決したある日本選手は、試合が終わった後、「まるで１人のように試合に溶け込む韓国選手の試合の様子が印象的だった」と話した。	在本届大会上与韩国选手进行过比赛的日本选手曾经表示：“韩国选手在比赛中就像是一体的，这令我感到非常震惊。”
朴ソンファ監督の韓国は９月８日、バーレーンとのアウェーゲームで１−０で勝利し、いったん「マチャラの呪い」からは脱した。	朴胜和教练帅领的韩国队，在9月8日与巴林的比赛中以1：0获胜，解除了“马卡拉的诅咒”。
10番はフリースローを打ってからでないと交代できない	要等他罚完球以后 才能换人
勝負よりも，友人帳の方が面白そうだ	比起这场比赛的胜负，友人帐更加有趣
コーチらの勝負操作の手口は大胆だった。	教练们进行胜负造假的手段更是大胆。
韓国女子バスケットボール連盟の金ドンウク専務は、「出場時間が短くて断定するのは難しいが、長身の高空バスケットボールは十分威力的だった」と評価した。	韩国女子篮球联盟专务金东旭（音译）评价说：“由于她上场时间较短，因此很难下定论，不过她的高空篮球非常有威胁。”
こうした状況の中、平昌五輪を成功させるために最も重要なのは、実際にロシア選手たちがどれだけ参加するかだ。	在这种情况下，为了在平昌冬奥会上取得成功，最重要的是，届时俄罗斯运动员到底会来多少。
オールスター戦を訪れた４万５１８６人とオールスター先発選手皆が、人生最後のオールスター戦のマウンドに立つサンドマン（眠りの精）を迎えた。	来观看全明星赛的4万5168名和全明星赛选拔赛全都站起来鼓掌，迎来了最后一次参加全明星赛的“睡仙（让对方睡觉的精灵）”。
わざわざ 試合しに来たかいはあったみてえだな	这样看来 也不枉我们特意来和他们比试一场
準決勝第２試合 薬師高校対 市大三高は	半决赛第二场比赛 药师高中对市大三高
スタメンから出るのは 初めてだ	第一次当先发球员
しかし、５番ホールの試合は崔京周がドロップした後、３打目を打った後まで続けられた。	但是5号洞的比赛，崔京周打了第3杆之后继续进行了比赛。
サンプトソンが１２勝目を飾って球団の外国人投手記録を更新したことは、これまでのハンファの外国人投手失敗の歴史を物語るものでもある。	桑普森取得12胜，刷新了球队的外籍投手记录，这一事实令人猜测到昔岁月里韩华队的“外籍投手残酷史”。
朴書記長は「ケ・スンヒが今回の大会で金メダルを獲得し、良い男性に出会えてお嫁に行ってほしい」と明るく笑った。	秘书长朴鹤永表示：“真希望桂顺姬在此次比赛上获得金牌，然后遇到一个好男人嫁出去。”
１７日、ソウル松坡区芳夷洞（ソンパク・バンイドン）のオリンピック公園フェンシング競技場で開かれた国民中心党の中央党創党大会で、共同代表最高委員に選出された沈大平（シム・デピョン）忠南（チュンナム）知事（左）と辛国煥（シン・ククファン）議員が手を上げて、代議員や党員たちの歓声に応えている。	17日，在首尔松坡区芳夷洞奥林匹克公园击剑竞技场举行的国民中心党中央党创党大会上，被评选为共同代表最高委员的忠南知事沈大平（左）和议员辛国焕携手共同举起，回应议员和党员们的欢呼。
前半のシュート数が１—８と言う絶対的な劣勢を見せた北朝鮮は、後半に入って多少活気を取り戻したが、１２分、李クムスクのシュートがクロスバーに当たって跳ね返される不運まで重なった。	在上半场比赛中，射门数以1比8处于明显劣势的北韩在下半场有所起色，但是下半场第12分钟李金淑的射门正中球门横梁。
韓国選手としては史上初めて４年連続で２勝以上をあげた朴仁妃は、「ゴルフというものは、１、２年目立っただけではだめだ。	作为历史上首次连续4年取得2胜以上的韩国球员，朴仁妃表示：“高尔夫运动仅凭一两年的闪亮表现是不行的，我为自己展现出一贯的面貌而感到自豪。
うえの３人がメジャー２勝に失敗すれば共同多勝（４勝）をマークしているウッズとデービッド・ラブ３世（米）は今大会で優勝しなくてもベスト選手を狙える。	如果上述3名选手未能夺得大赛2个冠军，则目前并列多胜（4胜）的伍兹和戴维斯·拉夫三世（美国）即使在本次比赛中未能夺冠，也有可能成为“今年最佳选手”。
だが，ここ一番で詰めの甘さが出るのは	但是，第一场比赛中你之所以被逼入绝境
洪監督は、Ａ代表のデビュー戦だった同日、「韓国型サッカー」で強いプレスと速い攻守転換を見せつけ、合格点を受けたが、決定力を高めなければならない課題も残した。	这是洪教练带领成人代表团的开场战役，在这一天虽展示了作为“韩国足球”的强势压迫以及迅速转换攻守，但也迎来了控球能力有待加强的作业。
今日の試合　降谷一人に任せてもいいのでは	今天的比赛 不如就交给降谷
キム・シウは４番と５番で連続バーディーを、１５番から１７番まで３連続バーディーを奪うなど絶頂の感覚を発揮した。	金时沅在4、5号洞连续抓下小鸟球，在15~17号洞又连续射落3支小鸟球，发挥出了绝佳的比赛感觉。
得点力に乏しく 圧倒的な勝利はない…	但因为得分能力不强 所以都没有大胜对手
スロースターターで初戦にピーク合わせない	比较慢热，第一场比赛不会有最佳状态
しかし、金ジュソン（東部）—ハ・スンジン（アナハイム）が守るゴール下に金ミンスまで加わることで、韓国の２００８年北京五輪の出場チケットの獲得の可能性はさらに高くなった。	在有金朱星（东部）－河胜镇（爱尼哈音）的基础上加上金民书，韩国获得２００８年北京奥运会入场卷的可能性将大大提高。
そんなふうに最後の戦いに挑めるだけで	或许，能以这种形式挑战最后一场比赛
ミケルソンに「後１勝だけできるとしたら、どの大会を選びたいか」と質問したら、その答えは決まっているだろう。	如果问米克尔森“只能夺冠一次的话，会选择哪个比赛？”
６回には優れた走塁プレーで中堅手前の２塁打を飛ばしたが、９回には四球に止まり、ついにホーム球場のファンの前でのホームランは炸裂しなかった。	6回是作为跑垒者的投了中坚手前的2垒打，但是在9回以四坏球上垒终究未能在主场球迷面前打出了本垒打。
でも，だんだん試合の雰囲気つかめてきたし	但是，我渐渐抓到了比赛的感觉
ピム・ファーベーク韓国サッカー代表チーム監督が、８日のガーナ戦と１１日のシリア戦を控え、「世代交代」の旗をあげた。	韩国国家足球队主教练皮姆·维贝克针对8日的韩国队-加纳队的比赛和11日的韩国队-叙利亚队的比赛，大胆进行“新老交替”。
オランダのサッカー専門誌「フットバルインターナショナル」は１４日付で、ボンフレール氏が「今アドフォカート監督が率いている韓国代表チームはすでに私が仕上げておいたチームだ。	荷兰足球专刊《voetbal international》14日刊报道说，邦弗雷雷表示：“现在阿德沃卡特主教练带领的韩国队是已经被我整顿好的队伍。
陵南対 海南大附属戦 前半 ９分１０秒	陵南对海南大附属的比赛 上半场九分十秒
ＫＬＰＧＡツアー前半で４勝を手にして、最多勝トップを走っているチェ・ヘジンは、９日から済州（チェジュ）オーラＣＣで開かれる後半最初の大会・三多水（サムダス）マスターズを心待ちにしてきた。	在KLPGA巡回赛上半赛季取得4胜，位居多胜榜榜首的崔惠珍，正在翘首以盼从9日开始在济州奥拉高尔夫乡村俱乐部举行的下半赛季首场大赛“三多水大师赛”。
韓国シリーズ９回の優勝に輝くヘテの金應龍（キム・ウンリョン）監督（現三星社長）が、万年準優勝チームの三星から「優勝請負」を受けた初年だった。	那一年是带领海泰队夺得9届韩国系列赛冠军的主教练金应龙（现三星总经理）接手万年亚军球队——三星队的邀请成为三星队主教练的第一年。
今日の試合は明日になれば完全に忘れてさらに頑張りたい」と話した。	一到明天就会完全忘记今天的比赛，今后将更加努力。”
負けたチームの選手に最高評点を与えるのは極めて異例のこと。	给输球球队的选手打出最高分是非常一反常态的事情。
今季の韓国女子プロゴルフ（ＫＬＰＧＡ）ツアー序盤に人気を集めているパク・ミンジ（２３＝ＮＨ投資証券）が、来月２日に開幕するマッコール、モナパークオープンで今季６勝目に挑む。	正在成为2021赛季韩国女子职业高尔夫(KLPGA)巡回赛初期(上半赛季)“大势”的朴民智(23岁•NH投资证券•照片)将在下月2日开幕的麦考尔•莫纳公园公开赛上挑战本赛季第6个冠军。
優勝無理とかふざけやがって	嘲笑我们肯定赢不了
いや 彦一 得点したのは俺…	不 彦一 得分的是我
お前，日本にもバスケのプロリ―グがあるのを知ってるか	你知道日本也有篮球的职业联盟吗
昨年の全国体育祭典で同種目１位の座を獲得したイム・ヒャンジュン（２２・競輪サイクル団）は３ｋｍコースに種目を変更し、２位が朴ハジョンだった。	在去年全国体育比赛时，曾获得该项目冠军的任香俊（音译，22岁，国家职业自行车队）将参赛项目改为原地出发3公里，而第2位人选便是朴夏祯。
プレー続行不可能となるケガをした場合	受了不能继续比赛的重伤的场合
前半、数度、威嚇的なシュートを放った韓国は、後半１９分、金勝龍がペナルティーボックス左側でフリーキックのチャンスを得た。	在前半场有好几个具有攻击性的射门的韩国在后半场１９分时，李承勇在左侧得到了任意球的机会。
「大リーグ３人組」ニューヨーク・メッツの朴賛浩（パク・チャンホ、３４）、コロラドの金炳賢（キム・ビョンヒョン、２８）、タンパベイの徐在応（ソ・ジェウン、３０）がなかなかスランプから脱却できずにいる中で、シアトルの右利きの投手の白嗟承（ペク・チャスン、２７）が印象的な完投勝ちで初白星を記録した。	“顶级联赛3人帮”纽约大都会队的朴赞浩（34岁）、科罗拉多洛基山队的金炳贤（28岁）、坦帕湾魔鬼鱼队的徐在应（30岁）迟迟没能从低迷的泥沼中摆脱出来，而效力于西雅图水手队的右手投手白嗟承（27岁）以让人印象深刻的完投胜迎来了自己的首个胜利。
ホント 今年の湘北は はっきり言って最強よ	今年的湘北篮球队 真是太棒了
それは落合監督の指導があったから ここまで…	这是因为有落合总教练的教诲 球队才能走到这里的
完全に試合終了	比赛终止了
ホリカワ選手，キタ選手でした。お疲れ様でした	以上是堀川选手和木田选手，辛苦了
このチームは，お前が引っ張ってきたんだ	这支球队由你一直带领至今
試合は勝った，けど…	比赛是赢了，可是…
モービスが今月１日にリーグ優勝を確定し、ＭＶＰ争いもモービスの内部競争になりそうだ。	摩比斯（Mobis）于3月1日已确定提前夺冠后，MVP之争恐怕也会成为摩比斯的内部之争。
フィギュアスケートグランプリシリーズ　世界一決定戦	世界花样滑冰大奖赛
正規リーグでＫＣＣに５勝１敗で勝った経験のある金ジン監督は、「ホールは頻繁なドリブルより機敏に動いた方が同僚の得点力を押し上げるのにプラスになる」として、「ＴＧは２対２プレーでチョ・ソンウォンの守備の弱点を攻撃する必要がある」と指摘した。	正规联赛比赛中本队与KCC队的战绩上以5胜1负占绝对优势的金镇主教练表示：“霍尔不易过于频繁带球，则应该积极的无球跑动，才能提高队友们的得分能力。
薄氷の差で１、２位を維持しているプロ野球の起亜（キア）と三星（サムスン）の競争が、まさにこの構図だ。	如履薄冰般排在第1、第2位的职业棒球起亚队和三星队的竞争就是如此。
ダスティン・ニパート（３７＝ＫＴ）やヘンリー・ソーサー（３３＝ＬＧ）らＫＢＯリーグで著しい足跡を残した長期在籍の外国人投手たちのプレーを、来年は見れなくなる可能性が高まった。	球迷们在明年无法看到达斯汀•尼珀特(37岁•KT队)、亨利•索萨(33岁•LG队)等曾经光耀KBO联赛舞台的长寿外援投手们的可能性进一步增大。
今日は花井君を打たせなきゃいけない試合だもんね	今天这场比赛也必须要让花井打出安打
体育祭だよ	我们要举办运动会
ほんなら，一子ちゃんと勝負して探してみたらどうけ？	那就借着跟一子比赛的机会来找找看如何
セネガルより１１１回多いパスを繰り出しながらも、５ポイント高いパス成功率（日本８４％、セネガル７９％）を記録した。	全场比赛日本队比塞内加尔队多传球111次，而且传球成功率也高出对手5个百分点(日本84%，塞内加尔79%)。
よっしゃ，ブレイク，も一本行けぇ	很好，连续得分，再来一球
チーム練習が終わった後は、金甫炅（キム・ボギョン）ら第２線の攻撃陣と一緒にパスの高低を調整し、２対１パスを交わしてシュートを蹴る練習を繰り返した。	在球队训练结束后与金甫炅等第二线队友们一起调整传球的高低，并反复进行2过1传球射门训练。
観客の好意も烏野への煽りに変わっていく	观众的好意会变成对乌野球员的煽动
これを入れて なんとか １ゴール差で終われば…	希望这次能够投进　结束时就只差一球…
力と力の真剣勝負　野球の醍醐味	力量间的正面对决 棒球的奥妙
これに、米ＬＰＧＡツアー１次クォリファイング・スクールをトップでパスした「スーパールーキー」の宋アリ（ソン・アリ、１７）が心ときめくプロデビュー戦を戦い、今大会には例年に増してさらに多くのファンの関心が集まっている。	此外，本次大会有在美国LPGA巡回赛第1次资格赛中获得第一名的“超级新秀”宋阿里（17岁）加盟，且是她的第一场职业比赛，因此，今年的大会比往年更有吸引力。
かっこよいプレーも良いが、ミスをせず安定的にポイントを得ることが重要だ」	漂亮的比赛虽然好，但最重要的在没有失误的情况下得分。”
そういうもん，全部ひっくるめたのが試合だ	比赛就是会出现这种种问题
ここがグレートスピリッツの指定した葉君最後の決戦場	这里就是伟大精神选定的叶最后一轮比赛的场地
ショートトラック男子のエース、ファン・デホン（２１＝韓国体育大学）は金メダル４個を首にかけた。	男子顶尖选手黄大宪(21岁•韩国体育大学)摘得了4枚金牌。
ほとんど，隙のないチームになる，	几乎就是完美无缺的球队
今年のＬＰＧＡツアーデビュー以来最高成績を挙げた朴城炫は、「正直、今大会以前は思うようにいかなくて苛立っていた。	取得今年出道LPGA巡回赛后最好成绩的朴城炫表示，“说实话之前的比赛有些放不开，感到很郁闷。
再びナツ選手と，ガジル選手に挑むのか	是否会再次向纳兹选手和戈吉尔选手发起挑战呢
３日、東京で開幕するグランフリーファイナル女子シングルで優勝を狙う金姸兒は、「グランプリシリーズ第５回大会の時のジャンプのミスはよい経験となった。	3日将在东京开幕的大奖赛女子单项决赛中，决心要取得冠军的金妍儿表示：“大奖赛系列第5次比赛中的摔倒失误是个很好的经验。
試合で，今のこいつと協力するぐらいなら	我觉得，与其跟这家伙合作
