許載は「大きな試合をたくさん経験したため、危機突破と機会活用には自信がある」と話した。	许财说：“因为经历过很多次大赛，我很有自信突破危机度过难关。”
「韓国テニスの看板スター」こと李亨沢（イ・ヒョンテク、三星証券、写真）選手が、男子プロテニス（ＡＴＰ）ツアーで３大会連続ベスト８に進んで、「強力サーブ」のアンディ・ロディック（米国）選手と対戦することになった。	“韩国网球代表明星”李亨泽（三星证券，照片）在男子职业网球巡回赛(ATP)中连续3站比赛进入8强，他将与“强劲对手”安迪·罗迪克（美国）展开较量。
一方、青森スポーツセンターで行われたカーリング男子決勝では、冬季アジア大会に初出場した韓国が、日本を下して初の金メダルの感激を満喫した。	另外，在青森体育中心举行的冰上滚石男子决赛中，首次出征亚冬会的韩国队击败日本队获得了宝贵的第一枚金牌。
さあ，試合開始だ	来，比赛要开始了
０２釜山（プサン）アジア大会のラグビー７人制と１５人制で、韓国の金メダル獲得に主役を果した李ミョングン（２７・写真）。	他是在2002年釜山亚运会上的7人制和15人制橄榄球比赛中为韩国夺得金牌做出主要贡献的李明根（音译，27岁，照片）。
ドルミッチは、試合終了後に失望した表情で、「今日のディ・マリアのプレーはファンタスティックだった。	赛后，约瑟普-德尔米奇并没有露出任何失望的表情，反而说到“今天迪马利亚的表现十分出色非常完美。
釜山の優勝はただで得られたわけではない。	釜山队获得胜利并非虚名。
選手が足りないんじゃ，来年のシード権取る意味すらない	参赛人数不够，就算成了明年的种子队也没有意义
この状況で，監督がお前をこのマウンドに送った意味	这种情况下，教练把你送上投手丘
昨年の全英オープンで優勝した彼女が今年もタイトルを防衛できれば、ミッキー・ライト（米国、ＬＰＧＡ通算２位の８２勝をあげた名誉の殿堂メンバー）に次ぎ、史上二人目の４大メジャー２年連続優勝者になる。	索伦斯坦在去年的英国公开赛上获得了冠军，如果今年卫冕成功，继莱特（美国、LPGA统计排名第2位的取得82胜的名誉殿堂会员）后，将成为历史上第2位连续2年获得4大赛冠军的选手。
３月の試合，鉄壁のブロック…	3月的比赛，铁壁般的拦网…
朴賛浩は２２日、オハイオ州シンシナティーのグレート・アメリカン・ボール・パークで開かれたシンシナティー・レッズとのアウェーゲームで、チームが９−１でリードしていた７回から登坂した。	朴赞浩于22日在俄亥俄州辛辛那提格雷特美洲球场举行的与辛辛那提的比赛中，以9比1领先的七轮开始出赛。
また、バントがうまい選手、守備がうまい選手など、チームとしてのまとまりを考えて代表選手を選ぶべきではないかと思う」	另外，我认为，在选拔国家队选手方面，应该那些挑那些能很好地击出触击球的选手、防守出色的选手等有助于改善球队的结构的选手。”
でもな，オファ―は九州のチ―ムからで	但是，邀请方是九州的球队
涼浦選手	凉浦选手
過去16年 連続インターハイ出場という 輝かしい記録を持つ	有连续16年打进高中联赛记录的王者
スピースは２２日、ワシントン州ユニバーシティプレイスのチェンバーズベイゴルフ場（パー７０）で開幕した今大会の最終ラウンドで、１打を減らし、通算５アンダー２７５でジョンソンとルイ・ウエストヘーゼン（南アフリカ）を１打差で振り切って優勝した。	斯皮思22日在美国华盛顿州大学城钱伯斯湾高尔夫球场（标准杆70杆）举行的此次大赛的最后一轮比赛中，打出了低于标准杆1杆的成绩，并最终以总成绩低于标准杆5杆共275杆，领先詹森和路易•乌修仁（南非）一杆夺得了冠军。
直近の３試合だけを見ても、韓国が２勝１敗で優勢だった。	从最近的3场比赛来看，韩国队以2胜1负稍处于优势。
李承鎏は、９イニングで日本打線を５安打１失点で防いだ具台晟（ク・デソン、韓火）と一緒に、その日の英雄だった。	当天，另一名选手丘大成（汉化）在9局比赛中，以5安打1失分挡住了日本击球阵容，李承烨和他一起成为了当天的英雄。
韓国選手3人 12日同時にマウンドへ上がる	3名韩国选手12日同时参加比赛
昨シーズン１０得点し、韓国舞台で無難に適応したコナンは、今季リーグの開幕戦で２ゴールを爆発させ、威力を見せつけた。	科南在去年的韩国职业联赛中曾经攻入10球，已经非常适应于韩国联赛，在今年联赛的揭幕战中连入2球，显示出了其超强的实力。
大韓サッカー協会の関係者は、「シュティリーケ監督の基本的な方向は、お宝探し、中盤での繊細なビルドアップ、セットプレーの完成の３つに集約される。	大韩足协相关人士表示：“施蒂利克教练选拔国家队球员的基本方向包括3个方面，即寻找未被发现的可造之才、打法细腻的中场，完善定位球战术等3方面。
本格的に五輪に向けた準備に乗り出したキム監督は、「五輪本大会ではパスのスピードや動きの積極性を高めて相手を制するサッカーをしたい」と構想を明かした。	正式开始备战奥运会的金教练表示：“在奥运会决赛阶段比赛中，希望提高传球速度和跑动的积极性，打造压制对方的足球。”
最近、クレーコート大会で優勝一回、順優勝一回の好成績を挙げ、強力な優勝候補とされている第５シードのロジャー・フェデラー（スイス）は、世界８８位の無名、ルイス・ホルナ（ペルー）に０−３（６−７、２−６、６−７）で完敗した。	最近在粘土球场取得一次冠军、一次亚军而成为最有力夺冠选手的5号种子费德勒（瑞士）惨败给世界排名第88位的霍纳（秘鲁）。
一方、ナ・リーグ東地区最下位のフィラデルフィア・フィリーズに移籍した金賢洙（キム・ヒョンス＝２９）はＰＳどころか、チーム内の地位まで危ぶまれている。	另一方面，转会到NL东部赛区最末位费城费城人队的金贤洙(29岁)不仅打不上秋天的棒球，就连在队内的地位也岌岌可危。
第２戦では、３—１でリードしていた９回無死１塁の場面でマウンドに立ち、３者連続三振で貴重な初勝利を守った。	在第2场比赛时，权五俊在3比1领先的第9回合，无人出局第1垒有人的情况下出场，连续投出了3个三振，取得了第1胜。
これに対し日刊スポーツは２５日、安が「Ｊリーグシーズンを終えてから考える」と述べたと、報じている。	《日刊体育》于25日报道，安贞桓就转会问题称：“J联赛本赛季结束后，再考虑这个问题。”
アメフトは一見、体の大きな若者がもつれてぶつかり合う単純で荒々しいスポーツのように見えるが、一瞬に多様な作戦が駆使される。	从表面上看，橄榄球只是一种块头大的年轻人互相扭打在一起的单纯而粗俗的运动，但橄榄球比赛往往要在一瞬间采取多种战略。
韓国代表の安秉勲（アン・ビョンフン＝ＣＪ）とワン・ジョンフン（韓国体育大学）は、今季に強い風と荒いラフで有名な欧州ツアーで活躍しており、リオでも突風を巻き起こすと期待を集めている。	韩国代表安秉勋(CJ)和王正勋(韩国体育大学)本赛季活跃在以强风和复杂的深草区著称的欧洲巡回赛赛场上，所以完全有理由期待他们能在里约刮起一阵旋风。
英国のＢＢＣ放送によると、１８日のサウサンプトン戦に出場した奇誠庸は後半２１分に交代されピッチを出る際、フランチェスコ・グイドリン監督との握手を拒否した。	据英国广播公司(BBC)透露，在18日同南安普敦队的比赛中首发出场的奇诚庸，在下半场第21分钟被替换下场后直接走下球场，拒绝了主教练弗朗西斯科•圭多林的握手。
よう 彦一	彥一 比赛都比完了
平昌（ピョンチャン）での活躍が期待される女子アルペンスキーのスーパースター、ミカエラ・シフリン（２２=米国）が２７日、ワールドカップ（Ｗ杯）で今季初優勝を飾った。	作为闪耀平昌的明星而受到关注的高山滑雪选手米凯拉•希弗琳(22岁，美国)27日获得本赛季首枚世界杯金牌，展现出了该项目“第一人”的实力。
何だ？何だ？勝負だとよ，勝負	怎么了？有比赛啊有比赛…
２１日、インドネシアのパレンバンで行われたジャカルタ・パレンバンアジア大会の男子１０メートル・エアピストル決勝。	21日，在印度尼西亚巨港的扎卡巴林体育馆举行的2018雅加达-巨港亚运会男子10米气手枪决赛。
開幕２連戦を行っただけだが、最も目立った打者は三星（サムスン）の外国人選手、オリアリー。	虽然只进行了开幕2场比赛，但是最引人注目的击球手当属三星特级外援奥里阿里。
さらに李承鎏は日本プロ野球にまだ適応していない時点であり、松坂は昨年ロッテ戦に４試合出場して、３勝無敗を記録した「マリンズ・キラー」。	再加上，李承烨尚未完全适应日本职业棒球，而松坂在与千叶罗德海洋队的4场比赛上创下了3胜无负的记录，是名副其实的“海洋队的克星”。
同じゴールまで走れ	向着同一个终点冲刺吧
この日の優勝は米国の「ジャンプマシーン」ネイサン・チェン（２８２．４２点）が飾り、準優勝は日本の宇野昌磨（２７５．１０点）だった。	当天的冠军归属于“跳跃机器”之称的美国名将陈巍(282.42分)帐下，亚军则是来自日本的宇野昌磨(275.10分)。
星野監督は、中日、阪神、楽天で計１４年間監督を務めながらリーグ優勝３回、日本シリーズ優勝１回（楽天）を達成した名将だ。	星野教练在中日龙队、阪神队和乐天队共当了14年时间的主教练，先后赢得3次联赛冠军，并夺得过1次日本大赛冠军。
第１戦で開催国ＵＡＥと１－１で引き分け「小さな異変」を起こしたバーレインは、インド戦で後半ロスタイムにＰＫで決勝ゴールを決め、組３位が確定した。	在第一场比赛中，巴林队以1比1战平东道主阿联酋队，爆出“小冷门”，并在同印度队的第三场比赛中在下半场补时阶段攻入制胜点球，从而锁定小组第三的位置。
第三十四回爆裂トライアスロン高校選手権	第34届 爆裂铁人三项高校争霸赛
五輪開催が迫って出場が決まる場合、一夜漬けの準備になってしまい、まともな技量を発揮できるのか疑問だ」と懸念を示した。	如果奥运会即将举办，确定参赛，我们就要‘临阵磨枪’，这种情况下能否正常发挥还是个疑问。”
来年には 俺の目ぇつけた選手が入ってくる	明年会有一个我很看好的选手加入
１５日の前後にもビックマッチが少なくない。	15日前后也有不少体育热点。
５０分のうち２０分は、引き分けとなった男子代表の韓国戦のハイライトを、３０分は北朝鮮が敗れた女子代表の韓国戦を放送した。	在50分钟时间里，前20时分钟播放了双方都没有进球记录的南北男足比赛的主要片段，后30分钟播放了北韩女足输掉比赛的南北女足对抗赛。
この天才が，バスケ部を優勝へ導く	我这个天才打算领导篮球队拿下冠军
昨年７月、東京アウェーゲームで行われた五輪代表の評価試合で豪快な３０ｍのキャノンシュートを決めた。	去年7月在东京进行的奥运会热身赛客场比赛中，他打进了一个漂亮的30米外任意球。
車範根氏（５８ゴール）、黄善洪（ファン・ソンホン）Ｕ―２３代表監督（５０ゴール）、パク・イチョン元仁川（インチョン）副団長（３６ゴール）、キム・ジェハン元大韓サッカー協会副会長、李東国（イ・ドングク＝以上３３ゴール）に次ぐ歴代６位の得点だ。	他将继车范根（58球）、23岁以下足球代表队主教练黄善洪（50球）、仁川前副团长朴利天（36球）、前大韩足球协会副会长金在汉、李同国（以上33球）之后，排在第6位。
勝者 ゴン選手	胜利者 小杰选手
障害者スキーの韓国代表選手として、一つの足と両腕でスキーを滑る「３トラック」を見せた李さんは、「勇気を出して不自由な自分の姿を見せながら、出場した選手たちに拍手を送る」と述べた。	李焕景（30岁）在5年前的服兵役中，因交通事故而失去了右腿，他是国家残疾人滑雪队的选手，他做了用一只腿和两手滑雪的“3肢体速滑”示范动作后说：“在此我向鼓起勇气，以不便的身体条件参赛的运动员送去掌声。”
ヒルは、昨年１１月以降、ほぼ１年ぶりに再びコートを踏んだこの日、３３分を出場し、１８得点、６リバウンド、７アシストの活躍を見せ、チームの９５−８８勝利をけん引した。	希尔自去年11月后一年来首次上场，在场上的33分中以18分6个篮板球7次抢断引导球队以95－88获得了胜利。
朴柱永は国家代表でもベスト１１に名を連ねるくらいの立派な選手だ。	朴周永是在国家队也会入选‘最佳11人阵容’的优秀选手。
李大浩がスピードに弱いところがあるけど、抜群の柔軟性と打撃勘を持っているので、メジャーリーグでも指名打者として十分通用するだろう」と話した。	虽然李大浩存在着速度上的弱点，但凭借着出色的柔韧性和击球感觉，他完全可以在美国职业棒球大联盟成为一名指名打者。
金承奎には、Ｊリーグのヴィッセル神戸が関心を見せている。	J联赛的神户胜利船队正对金升圭非常关注。
チーム同僚のアレックス・ウッドが５．６３点で全体５位で、前田健太、クレイトン・カーショーも５点台の援護を受け２０位以内に名を連ねているのとは対照的だ。	另一方面，队友艾利克斯•伍德以5.63分排在了第5位，马埃达•坎塔、克莱顿•克肖都以5分多的得分支援排名前20位，与此形成了鲜明对比。
野球関係者らは、「朴賛浩が全盛期の『コリアン特急』に戻ってきた」と口を揃えている。	棒球界人士纷纷表示: “朴赞浩找回了全盛期的状态” 。
崔炯宇（チェ・ヒョンウ）も「同じ条件なら」メジャーリーグ進出を先に考慮するとの立場だ。	崔炯宇的立场是，在同等条件下将优先考虑进军美国职棒大联盟。
先月末、米国ＰＧＡツアーのソニーオープンで、わずか１打差で予選通過に失敗したウィーは、日本プロゴルフ（ＪＧＴＯ）と地元のクラブに所属するプロゴルファーたちが主に出場した同大会で、持ち前の長打を惜しみなく発揮した。	上月在美国PGA巡回赛索尼公开赛上，因1杆之差未能通过资格赛的米歇尔·魏在以日本职业高尔夫（JGTO）和地区俱乐部职业选手为主的此次比赛中，也毫不例外地表现出了长打能力。
しかし、当時、テストに居合わせなかった星野仙一監督は、「実戦から長く離れていた選手を２日間のテストで判断するのは難しい。	但是，当时没有亲自观察测试的星野仙一主教练则表示：“仅凭借两天测试很难对长时间离开实战赛场的球员进行正确评价。
国際大会に参加するたびに、イ監督は選手控え室の周辺をぶらついた。	每当国际大赛时，李教练就会在运动员休息室周围晃悠。
ええ チームを去るのは私のほうだということです	没错 要离开球队的应该是我才对
ま　俺が甘すぎたことは試合後みんなに謝るとして	我要求不严格这件事比赛之后得向大家道歉
でも授業のソフトボールであんなに本気出すなんて	但是，上体育课你也使全力
勝って，決勝リーグだ，	打赢他们进入决赛
毎年新入部員が入ってすぐ，雰囲気見るためにやってるゲームだ	每年新生入部之后都会马上举行比赛，以便掌握大家的水准
来年の五輪も同じです」。	明年奥运会也是如此。”
８日、亀尾（クミ）の朴正熙（パク・ジョンヒ）体育館で開かれたバレーボール「ＫＴ＆ＧＶツアー２００４」亀尾（第４回）ツアー男子決勝。	8日，龟尾朴正熙体育馆举行的排球KT＆G　V巡回赛2004龟尾（4次）男子组决赛。
今大会は奨忠（ジャンチュン）高やソウル高などソウル地域のチームの優勢が予想される中で、青龍（チョンリョン）旗大会準優勝チームの江陵（カンヌン）高、伝統の野球名門の釜山（プサン）高や天安北一（チョンアン・ブクイル）高などが注目を集めている。	在本届大赛上，奖忠高中、首尔高中等首尔主场球队的优势很明显，但青龙旗大赛亚军江陵高中、传统棒球豪门釜山高中、天安北第一高中也具有不可轻视的实力。
補欠を出すとは ついに 試合を捨てたか 翔陽	派替补上场 翔阳要放弃比赛了吗
一方、朴セリ（ＣＪ）は同日１打を縮めるにとどまり、先頭に６打差つけられた４位タイとなり、最年少キャリアグランドスラム記録達成は不透明になった。	另外，朴世利（CJ）在当天比赛中只减少1杆，落后第1名6杆排在了并列第4位，因此在实现最年少职业大满贯上遇到了困难。
柳承敏は１８日、富川（ブチョン）の松内（ソンネ）社会体育館で行なわれた「ＫＴ＆Ｇ世界トップランカー招請卓球フェスティバル」大会で、０４アテネ五輪決勝以後、６カ月ぶりに対決した王皓に、１−３（１３−１５、１１−５、２−１１、１０−１２）で負けた。	18日，柳升敏在富川松内社会体育馆举行的“KT&G世界顶级选手乒乓球邀请赛”上，被2004年雅典奥运会半决赛结束6个月后再次相遇的王皓以1-3（13-15、11-5、2-11、10-12）打败。
フロアマスターへの挑戦権を懸けた試合へと変わり	与打擂台的比赛不同
同等なレベルの選手でも精神力によって結果は違ってくる。	水平相当的选手之间也会根据精力，产生不同的结果。
レギュラーなんか，簡単になれるもんやない，	都很难当上正选的球员
昨年３月、プロテストを経て、７月にデビューしたウ・ジヘは、「チャンピオンの娘」らしく３戦全勝をおさめてチャンピオンに上がった。	禹智惠去年3月经过职业考试于7月初次登上职业拳击台，她没有辱没“冠军之女”的称号，以3战全胜的战绩登上了冠军宝座。
ゴール下を固めろ，	巩固篮下
優勝を決めた韓国系のイ・ミンジ（２３＝豪州）は同僚の選手たちから祝福の水洗礼をを受けて歓呼した。	确定夺冠的澳大利亚侨胞李旻智(23岁)在赛场同僚的祝贺下欢呼庆祝。
何？あのげんこつのキャプテンを怒らせちまったのか？	什么？有人敢招惹那个 拳头那么硬的篮球队队长！？
バスケットマン桜木君が初めてダンクを決めた試合だもの	这是篮球明星樱木，第一次灌篮得分的比赛
予選を経て、メジャー大会に初出場した李亨沢は好プレーをして、２万人が埋め尽くしたセンターコートでサンプラスと８強進出をめぐって争った。	经过资格赛第一次挺进职业网球大赛的李亨泽一路奏响凯歌，最后在坐满2万名观众的中央球场与桑普拉斯进行了争夺8强席位的斗争。
選手たちも頑張っていますので、良い結果が出せそうです」	队员们也非常努力，因此，会取得好成绩。”
李キョンス（１８得点）とオム・チャンソプ（１２得点）もあわせて３０得点を挙げた。	李京洙（得18分）和严昌涉(得12分)合作共得30分。
柳賢振が６回８三振無失点、オークランド戦で今季初勝利	道奇队的柳贤振在与奥克兰队的比赛中以6局无失分的好成绩获得赛季首胜
残り５分には，点差は逆に，	比赛的时间只剩下5分钟
フリースローも決まって，得点は１５対０，	湘北被判罚球，分数是15比0
けどコンクールは優劣をつける	但是 比赛会分出高下
昨年も、正規シーズン後半期だけで１０勝４敗、防御率２、４７を挙げた三星のガルベスが、韓国シリーズ２試合で６イニングの間、１０点も失点してしまった。	去年，在正规赛季后期创下10胜4负、2.47平均自责分的三星队的加尔贝斯，在韩国联赛的2场比赛中，6回合内连失10分，致使球队一蹶不振。
朴チョンウンは６４−６７でリードされていた４クオーター終盤に２点シュートを成功させたのに続いて、６６−６８の状態でまた鮮やかな３点シュートを入れ、勝負を決めた。	在三星生命队以64比67的比分落后于对手的第4节末，朴正恩成功地投进了2分球之后，在66比68的关键时候，她再次投中一个干净利落的三分球，分出了胜负。
アシストランキングでもメド（５・浦項）とアンドレー（４・安養）が１、２位を占め、序盤の記録争いは外国人選手たちのお祭りとなった。	助攻方面也是梅道（5次，浦项队）和安德烈（4次，安养队）分别排在了第一、第二位。
そして 試合の日は来た	终于到了比赛的日子
徐在應は試合後、「電光板に示される球速が毎回８０マイル（１２８ｋｍ）そこそこでしかないのを見て驚いた」と話すほどスピードが出ず、悪戦苦闘した。	当天，比赛结束后徐在应表示：“看到电子大屏幕上显示的每次的球速勉强能超过每小时80英里（128公里），吃了一惊。”
選手には睨まれるし	又是被对方队员怒目而视
なんとか，ゾーンを切り崩さないと，	必须要想个办法，打破他们在罚球线的防守
高麗大センターのハ・ジェピルは２１得点、９リバウンドでゴール下を守った。	高丽大学队中锋河在弼拿下21分，抢到9个篮板球。
フルコースレース男子部では、オ・ジョングン（２８）さんが２時間３５分１３秒で優勝し、女子部では外換（ウェファン）銀行の「走る広報ウーマン」金ヨンア（３３）さんが２時間５８分２０秒でトップを占めた。	全程赛的男子组中吴静根（28岁）以2小时35分13秒夺得冠军，在女子组，外换银行“奔跑的女宣传人”金英儿（33岁）以2小时58分20秒夺冠。
スカイスポーツは、薛鐗鉉にチームで２番目に高い７点の評点を付けた。	天空体育给薛琦铉打出7分的评分，这在队内并列第2位。
目標は，個人戦各階級優勝	目标是个人赛各个级别优胜
サボってる三年がコンクールに出るみたいなのは	代替我们努力向上的一年级学生去参加比赛
特にこの柳賢振の防御率は、最近メジャーリーグで起きている極端な「打高投低」現象の中で記録したもので、一層輝きを放つ。	特别是柳贤振的这种平均责任失分记录，是因为最近美国职业棒球大联盟正经历着极度的“打高投低(击球手强投手弱)”现象。
史上初のベスト１６入りを目指す韓国が最も警戒すべき選手は、「女ペレー」のマルタ（ロセンゴルド＝写真）だ。	以史上首次进军16强为目标的韩国队，最应该警惕的当属有着“女贝利”之称的马塔（洛杉矶队•照片）。
甘いもの好き 世界選手権好き	喜欢甜食 喜欢世界选手权
