許載は「大きな試合をたくさん経験したため、危機突破と機会活用には自信がある」と話した。	许财说：“因为经历过很多次大赛，我很有自信突破危机度过难关。”
０６年ドーハアジア大会（金東進、李天秀、金斗鍱）、０８年北京五輪（金正友、金東進）で李天秀（イ・チョンス）と金東進（キム・ドンジン）が、１ゴールずつ決め、ワイルドカードの不運を払拭するかのように見えたが、期待には及ばず、成績も今一だった。	2006年多哈亚运会（金东进、李天秀、金斗炫）和2008年北京奥运会（金正友、金东进）时，李天秀和金东进各入一球，本以为终于能够逃掉“外卡厄运”，但在随后比赛中的表现不尽人意，球队最终成绩也不佳。
駒野先輩は初戦がいきなり準決勝だし	驹野前辈也是，一上场就是半决赛
ヴィクトルと一緒に，今度のグランプリファイナルで優勝目指します	我将和维克托一起，努力赢下这次的大奖赛总决赛
それでも李ヒョンイルは「スポーツに没頭する時に一生懸命していれば、格好は問題ではない」として、イヤリングにもこだわった。	即使如此，李铉一还是提出“只要认真对待羽毛球运动就行”的主张并执意带着耳钉。
李記者はこの手記で、ベルリン五輪マラソンで優勝した孫基禎（ソン・ギジョン）選手のユニホームの日の丸を消して報道した情況と、当時東亜日報編集局内の抗日意識、３・１運動を彷彿させた国民情緒などを詳しく記録している。	当时，孙基祯选手在柏林奥运会马拉松中夺冠，而李吉用在这则手记中详细记录了抹去孙基祯选手运动服上的太阳旗进行报道的情况、当时《东亚日报》编辑局内的抗日仪式、类似于3•1运动的国民情绪等。
「コリアンモンスター」柳賢振（リュ・ヒョンジン＝３３，トロント・ブルージェイズ）が２６日、米国のＣＢＳスポーツが選んだ「２０２０シーズン、オールスターチーム」に名を連ねた。	“韩国怪物”柳贤振(33岁•多伦多蓝鸟)26日入选了美国体育媒体CBS体育评选的“2020赛季全明星队”。
国際大会に何度も一緒に出場した経験がある韓国ペア代表のキム・ギュウン選手（１９）は二人について、「情熱的にスケートを滑っていて、表現力も良い」と話した。	曾多次参加过ISU四大洲锦标赛的韩国选手双人滑选手金奎恩(19岁)对两位选手评价说，“很有热情地滑冰，表现力也很好。”
イングランドはウェイン・ルーニーが前半２９分、マイケル・オーエンのパスをゴールに成功させて機先を制するようだったが、ヒディンク監督の後半交替カードが勝負を逆転させた。	英格兰鲁尼在前半场29分钟时，接过迈克尔.欧文的传球先进一球，但是在后半场希丁克教练交替选手后，完全改变了场上局势。
安西監督の指示による１年対２～３年の練習試合では	安西教练指示 一年级跟二、三年级分成两队做练习比赛
米大リーグ現役最高の右翼手は誰か。	现任职棒联盟选手中最优秀的外野手是谁？
孫興民がインテルを相手に欧州リーグ通算１００得点（１軍試合基準）を達成できるかにも注目が集まる。	孙兴慜在对阵国际米兰队的比赛上，能否攻入自己在欧洲足球舞台上的第100粒进球(以一线队为准)，也备受关注。
ばれんかったら優勝やったがに	如果没穿帮就能获胜了
気の抜けた最下位決定戦になる可能性もあったが、第４ピリオドまでの３２分間、大接戦が繰り広げられた。	虽然比赛很有可能变成提前泄气的“倒数第一争夺战”，但是到第4局为止，两队进行了32分钟你来我往的胶着比赛。
終わっちゃった，詩暢ちゃんとの試合	结束了，和诗畅的比赛
躊躇なく投げてきやがった，監督の胸元に	朝着教练的胸口毫不犹豫地投出去了
不意の事故で片足を失った李選手は１、２回目の合計２分４５秒００で２６人の出場選手の中で１０位の結果を出した。	因意外事故而失去了一条腿的他以第1、2轮合计2分45秒00的成绩，在26名出战选手中居第10位。
同大会では、林監督をはじめ、チョン・ジュヒョン前コーロン監督が指導しているシャンソン化粧品、チョン・ヘイル前国民銀行監督のいるトヨタ自動車、昨年まで金ピョンオクさんが技術顧問していたジャパンエナジーが準決勝へと勝ち進み、激しい韓流熱風を巻き起こしている。	进入该比赛4强的球队是，包括任勇宝在内，由前可隆队主教练执教的Chanson化妆品队、前国民银行队主教练郑株铉（音译）指导的丰田汽车队、到去年为止由金平玉（音译）担任技术顾问的Japan Energy队，从而掀起了强大的韩流热潮。
報道を担当した記者は、「秋信守が主要攻撃記録でチーム内で１位に上がってはいるが、他の選手の活躍が切に求められている」と評価した。	发表新闻的记者 Jerry Crasnick评价道：“在主要攻击记录中，秋信守排队内首位，但是他急切地需要其他选手的协助。”
球団を訴える。	我要告棒球俱乐部
どうも韓国が全勝で優勝しそうな予感」と言った。	我预感，韩国队肯定会以全胜的成绩夺得冠军。”
米国進出６シーズン目にして、これまで待ちに待った優勝トロフィーをメジャー大会で手にする可能性が高くなった。	迎来进军美国的第6个赛季，苦苦期盼的首次冠军奖杯很有可能会在此次比赛上收入囊中。
李鳳柱が優勝した後、「五輪の金メダルに再挑戦する」と言ったのも、まだ最盛期に劣らない走り方ができるという自信を得たからだ。	李凤柱得到冠军后说“要再次挑战奥运金牌”，也是因为得到了全盛时期的自信。
ユ・ムンジョン大韓陸上競技連盟施設委員会副委員長は、「上り坂はマラソンランナーにとって負担となるものだが、上り坂区間がなくなり、マスターズは自信をもって走れるようになった」と評価した。	大韩田径比赛联盟设施委员会副委员长刘文钟（音）评价说：“山坡路只会对马拉松选手带来负担，随着上坡路区段被取消，能使马拉松选手充满自信参加比赛。”
さあさあ始まりました　時間がありませんよ	比赛开始 没时间了哦
スピード・スケーティング最高のスプリントを決める男子５００メートルで、韓国は李ガンソクが１位、李ギホ（檀国大学）とモ・テボム（蚕室高校、韓国体育大学入学予定）が２、３位を占めた。	代表速滑最快速度的男子500米中，韩国队的李康锡夺得冠军，韩国队的李起浩（音，檀国大学）和毛太范（音，蚕室高中，将进入韩国体育大学）横扫了第2、3名。
—今大会の優勝でタイガー・ウッズのようなスターたちと一緒にトロフィーに名前が刻まれるようになるけど。	——由于这次大赛夺冠，你的名字将和伍兹那样的巨星一起留在这个冠军奖杯上……
綿谷くんの試合，初めてちゃんと見ました	绵谷同学的比赛，我第一次这么仔细地看
「大黒柱」になるはずだった朴智星（ＰＳＶアイントホーヘン）を国家代表チームに奪われた上、「ワイルドカード」の宋鍾国（ソン・ジョングク、フェイエノールト）まで負傷でエントリーから外されたため、戦力が大きく弱化し、心配が並大抵でなかったからだ。	因为“可信赖的”朴智星（PSV埃因霍温队）被国家队抢走，就连宋钟国（费耶诺德队）也因伤无缘奥运会，由此造成的战斗力下降令金镐坤忧心忡忡。
番号や結果にいちばんこだわるのは 戦っている選手たちでしょ	最拘泥于号码和结果的 不就是在场上奋战的选手本人吗
＃２ボル氏は２７日、１００メートル自由形の予選を控え、再び朴泰桓を呼んだ。	# 2 .保尔教练在27日100米自由泳预选赛前夕和朴泰桓谈了话。
天才による 試合を決定づける1発を	这就是天才决定胜负的一球
この日の優勝で朴仁妃は年間最優秀選手ポイント３０点を追加し今大会に参加しなかった１位のコーを３点差に詰め寄った。	凭借着当天的夺冠，朴仁妃取得了30个年度最佳选手积分，同不参加本场比赛的第1位高宝璟的差距只剩3分。
ＭＬＢ．ｃｏｍも「姜正鎬が最初のオープン戦で一部で持ち上がった憂慮を振り払った」と伝えた。	MLB.com也表示：“姜正浩在季前赛首场比赛上的表现消除了部分人的担忧。”
そう，これからが本当の勝負よ，	没错，从现在开始才是真正的比赛呢
彼をどれだけ早いうちにつかまえるかで試合が決まるよ	越早压制住他就能越快决定比赛的胜负
韓国が無気力な試合をして引き分けたことには残念という反応が少なくなかった。	对于韩国队在一场无精打采的比赛之后与对手握手言和，不少人表示遗憾。
球団創立から８年ぶりに韓国シリーズを優勝したＳＫは、個人タイトルの受賞者こそ一人もいないが、選手全員が「つなぐ野球」を見せており、ケニー・レイボーン、マイク・ロマノ、チェ・ビョンヨン、金グァンヒョンにつながる鉄壁マウンドと強力なブルペンも強みだと分析した。	读卖新闻分析，编队8年后取得韩国联赛冠军的SK队虽然没有联赛个人奖获奖者，但是全体队员显示出了“连线棒球”阵势，以雷鹏，罗曼诺，蔡炳龙为一体铁壁投手土墩与强硬的候补投手也是很有实力的。
５番にも３ポイントがあるかもしれん	五号可能，也会投三分球
ノ・ジェギル慶南陸上競技連盟常任副会長は、「大邱大会の成功のために、嶺南圏はもちろん、湖南（ホナム＝全羅道）圏の陸上関係者まで参加する方案を検討中だ。	庆南田径竞赛联盟常任副会长卢载吉（音）说：“为了成功举办大邱世锦赛，正在讨论岭南圈、湖南圈田径人士共同参与支援的方案。
試合のためによく食べて体力をつけておくよ	为了比赛要多吃点储备体力
今度の試合では，必ず点を取ってみせます	下次的比赛，我一定会得分的
後２試合だけフルタイムを消化し無失点を守り抜けば、彼は世界新記録を樹立することになる。	如果在接下来的两场比赛中都不失球，他将创下世界新纪录。
「タンク」崔京周（チェ・ギョンジュ、３７、ナイキゴルフ）がゴルフ大陸対抗戦プレジデント杯で、最終日に勝ち点を加え、世界ランキング第１０位の面子を立てた。	“坦克”崔京周(37•NIKE高尔夫)在高尔夫大陆之战总统杯的最后一天获得胜利，挽回了世界排名第十的面子。
今回優勝すればフィギュアのグランドスラムを完成することになる。	如果他在本次比赛上夺冠将实现花样滑冰大满贯的伟大成就。
三星（サムスン）証券のチュ・ウォンホン監督は、「ロディックの強いサーブをどれほど効果的にリターンするかによって、勝敗が分かれるだろう」と話した。	三星证券教练朱元洪预测说：“怎样有效解决罗迪克强有力的发球问题将会决定胜负。”
予選を７戦全勝で突破した韓国は、歴代最強のメンバーで臨んだ日本まで撃沈させ、五輪初の決勝進出を果し、銀メダルを確保した。	预选赛7战全胜的韩国气势高昂，不仅打败了历代实力最强的日本队，还确保了有时以来的首次银牌。
しかし、先月飲酒事件の際、韓国野球委員会（ＫＢＯ）が決めた５試合出場停止の懲戒処分を受けなければならない。	目前他的身体状况除防守外完全可以胜任击球和跑垒，但必须接受上月发生酒后驾驶事件时，韩国棒球委员会（KBO）做出的停赛5场的惩罚决定。
選手入場	选手上场
個性満点で、実力も満点の金スンヒョンがシーズン序盤からコートを熱く盛り上げている。	个性完美、实力完美的金胜铉从本赛季刚开始就火遍了各个球场。
試合途中、オリオンズのベンチで金ジン監督（４２）がいきなり立ち上がってカードを抜いて振るのだ。	比赛时坐在教练席上的Orions队的主教练金镇（42岁）突然起身手举卡片挥动。
唯一のピンサーで出た試合はサーブミスで一発終了	唯一一次作为救场发球员上场，一发失误直接结束了比赛
「とりわけ韓国のようなところでは、スポーツ心理学がさらに重要です。	“尤其在像韩国这样的地方，体育心理学就显得更加重要。
サッカー，映画，駿は喜んでいました。	踢足球，看电影，小骏很高兴，
「ビッグ・ママ」の李知映（イ・ジヨン、ハイマート）は昨年のチャンピオンのカリー・ウェブ（豪州）と３位タイ（２アンダー、７０）で試合を終えた。	“超级妈妈”李知映（Himart）和去年的冠军得主凯莉·韦伯（澳大利亚）以并列第3位（低于标准杆2杆共70杆）结束了首轮比赛。
本当に 全国も夢じゃないかもしれない	全国冠军再也不是夢想了
朴監督は、世界ジュニア選手権大会（６月１０日〜７月２日・オランダ）を控えて１１日、京畿道坡州（キョンギド・パジュ）の代表チームトレーニングセンター（ＮＦＣ）に招集されたジュニア代表メンバーを前にして深い溜息を吐き出した。	即将出征世界青少年锦标赛（6月10日～7月2日，荷兰）的他，11日，面对召集到京畿道坡州国家队训练中心(NFC)的青少年队员叹了一口长气。
Ｗ杯決勝戦に警察官の姿で乱入した４人は？	在俄罗斯世界杯决赛当时身穿警服乱入球场的4人下场如何？
２人は共に今季、紆余曲折の末、現在の所属チームのユニホームを着ただけに、ゴール成功の喜びはさらに大きかった。	因为两位选手在本赛季都是历经艰辛才得以身披现役俱乐部的队服，所以这场胜利带给他们各自的喜悦不同凡响。
バレーに特別変わったルールがあるとしたら	如果说排球有什么特殊规则的话
また、００年のアジア大会当時、許監督と試合に出場した李雲在（イ・ウンジェ、水原）、李栄杓（イ・ヨンピョ、ドルトムント）、朴智星（パク・ジソン、マンチェスター・ユナイテッド）も雪辱の機会を得た。	2000年与许丁茂主教练一同参加过比赛的李云在（水原）、李荣杓（多蒙特）、朴智星（曼联）也得到了复仇的机会。
たいいくかん	体育馆
アマチュアだった昨年、既にプロ大会で２勝を収めた金ギョンテは、１２月、ドーハアジア大会で、史上初めて男子ゴルフ２冠を達成した期待株だ。	去年以业余选手的身份已经在职业比赛上夺得2个冠军的金景泰是在12月的多哈亚运会上历史上首次登上男子高尔夫双冠王的希望之星。
じゃあ 明日の試合は	那明天的比赛呢
５日間で勝者を決めるトーナメントの日程と	考虑到五天内就要决出冠军的紧凑淘汰赛日程
監督は昨年Ｋリーグチャンピオンの水原三星（スウォン・サムスン）に勝つ自信があるのかという質問に対して「世界的なスターを保有しているレアル・マドリードも負け続ける時がある。	他对是否有信心战胜去年K联赛冠军水原三星队表示：“拥有世界级的明星的皇家马德里队也有连续输球的时候。
世界ランキングは、同い年のライバル浅田真央（日本）に次いで２位だが、事実上のフィギュアチャンピオンは金妍兒であるということを「宣布」したも同然だ。	虽然在世界排行中金妍儿在对手浅田真央之后位居第二，但是事实上已经“预告”了金妍儿是花样滑冰冠军。
「メジャー大会優勝で無冠の恨みを吹き飛ばず」	“将以大型比赛冠军消除无冕的遗憾。”
総合格闘技の選手でも腰抜かすぜ	就算是綜合格斗技的选手也会腿软的
あの10番が，イージーシュートを	如果湘北那个十号选手，投球不要那么多失败的话
何て でけえチームだ	这个球队的人都好高大
練習を終えたチャ・ジュンファンは、「練習開始前に『五輪に参加する選手たちを歓迎します』という場内アナウンスを聞いて、五輪に参加したことを実感した」と語った。	练习结束后，车俊焕说：“在练习开始之前，听到了‘欢迎参加奥运会的选手们’的场内广播，产生了自己即将参加奥运会的真切感受。”
同点に追いついた	在篮下投篮得分把比分拉平
「アシアンカップ本選までは退くつもりはない」	“到亚洲杯决赛阶段为止，没有辞职的意向。”
昨年末、世界ジュニアランキング４位をマークしたチョン・ウンソンは、今季大人の舞台にデビューする。	去年年末世界青少年排名第4位的全雄善在本赛季将转入成人赛场。
１４日、北京五輪スポーツセンター体育館で開かれた男子ハンドボールのリーグＢ組の第３戦で、韓国のユン・ギョンシン（右）が、アイスランドの守備の壁の上で、ジャンプシュートをしている。	于14日，在北京奥运会体育中心体育馆举行的男子手球B组第三次赛事中，韩国选手尹京信（右侧），向爱尔兰的防守，给予跳跃式投球。
でも，前のコーチが…	但是之前的教练…
前半期には、セントラルリーグ本塁打第１位（２９個）、打率第３位（０．３２３）、安打第２位（１０９個）、打点第４位（６４個）、得点第１位（７０個）の抜群の成績を出した。	在上半赛季，取得了中央联盟本垒打排行榜第1位（29个），安打率第3位（0.323），安打第2位（109个），打点第4位（64个），得分第1位（70个）的辉煌成绩。
直人にイチロー選手を見せてやりたい，っていうのは，ただの口実で	想带直人来看一朗选手的比赛，只是借口
前半期に打率．２６８、４本塁打、２９打点を記録した姜正浩は、後半期にも猛打を奮っている。	前半赛季取得击球率0.268、4记本垒打、29打点的姜正浩，在后半赛季正继续高歌猛进。
仙台市体育館再び	又回到仙台市体育馆了
０７年中国長春冬季アジア大会で、韓国のショートトラック女子代表選手らは、授賞式で「白頭山（ペクトゥサン）は韓国の領土」というびっくりカードセクションを展開し、韓中外交問題に飛び火するところだったこともある。	2007年，在中国长春举行的冬季亚运会上，韩国短道速滑选手们，在颁奖仪式时，突然展开“长白山是我们的国土”的标语，差点酿成中韩外交问题。
試合前にジュソンノ（仁荷大学監督）、千普成（チョン・ボソン、韓国野球委員会競技運営委員）台湾戦力分析チームは一様に「李鍾範（イ・ジョンボム）、金ジョングク（以上起亜）など速い足の選手たちの機動力がカギ」と指摘した。	在比赛前，由朱成鲁（仁荷大学教练、音译）和千普成（韩国棒球委员会比赛运营委员）组成的台湾战斗力分析组一致地指出：“关键是李钟范和金钟国（以上是起亚）等速度快的队员的机动能力。”
チュ・シンス（２２、シアトル）は同じ試合に左翼手として途中から出場、２打数１安打を記録した。	秋辛洙（22岁，西雅图水手队）在同场比赛中，作为交替左翼手击出了2个有效击球，1个安打。
いいか，ここまで来たら，	听好，比赛已到了这个地步了，
相手は去年の準決勝であたった青道だけど…	明天的对手是你们去年半决赛的对手青道…
今夜最高得点を樹立できるかもな	今晚说不定能拿到最高分
まさか 前の試合引きずってねえよな	难道是还记着上场比赛的失误吗
黄瀬，監督の指示に従え	黄濑，服从教练的指示
昨年、安是眩（アン・シヒョン、コーロンエルロード）が立てた大会最少打記録（１２アンダー２０４打）を４打も減らした新記録。	该成绩创下了新纪录，比去年安是昡（可隆ELROD）创下的比赛最少杆数纪录（低于标准杆12杆共204杆）减少了4杆。
そうそう，マラソン中に急に	没错没错，在跑马拉松的时候突然就
オレンジカウンティは最近、チームのホームページで「ワールドシリーズ優勝の経験を持つベテラン投手金炳賢を獲得した」と発表した。	Orange County Flyers近日通过官网表示：“球队引进了拥有世界系列赛冠军经验的老将——金炳贤投手。”
流鏑馬の出場は諦めなさい	骑射比赛你就不要参加了
パク･チャンホは30日、ミルウォーキーカウンティースタジアムで行なわれたミルウォーキーブリュワーズとの遠征試合で8イニング中14の三振を奪う快投でチームを7対2で勝利に導いた。	朴赞浩于30日在密尔沃克.卡温蒂运动场举行的密尔沃克队的远征比赛上8局中投出14个三振，使达泽斯队取得7：2的胜利.这已是他本赛季第14次（8负）胜利，平均失误降到了3.60.
これにスポーツ新聞は、先を争って、「井口が鬼教官に、金泰均が冷や汗を流した」と報じた。	结果，日体育报刊争先报导：“因井口资仁担任训练教官，金泰俊捏了一把汗。”
とりわけ、宋アリと違って、米国のコースに馴染みの薄い安是眩が、デビュー戦でホールインワンまで記録しながら、堂々と「トップ５」入りを果たしたことは、たいしたものだ。	特别是与宋阿里不同首次踏进美国赛场的安是昡在首战比赛上还成功打出一击进洞球，并堂堂正正地进入“前5名”，这也是非常骄人的成绩。
中国戦を観戦した韓国代表の金ジン監督と朴ゴンヨン・コーチは「王治ジが欠場しても、中国の戦力は弱まるどころか、むしろゴール下は強くなっている」と口をそろえた。	在现场观看中国队比赛的韩国队教练组和主教练朴健延异口同声地称：“王治郅的缺战不仅未使中国队的实力变弱，反而篮下防守变得更加坚固了。”
一方、柳昇敏は、金ヘヒョン（大韓航空）選手とペアで出場した混合ダブルス６４強戦では、日本の水谷・梅村組に先に３セットを渡したが、その後で４セットを連取して勝つ劇的な逆転勝ちを収めて、３２強戦に進出した。	另外，柳升敏和金慧贤（音译、大韩航空）配对出战的混合双打63强赛上，先被日本的水谷准–梅村礼组合拿下3局之后，连扳4局，取得了戏剧性的反败为胜，从而成功晋级32强。
心配すんなって あるときはゴール下の覇者	不要担心 有称霸篮下
大丈夫に決まってるだろ ただ試合を見るだけなんだから	当然没事啦 只是看比赛嘛
リーグ６連覇に目指す首位の広州恒大（勝ち点５６）とは６点差。	与挑战联赛6连冠的领头羊广州恒大队(56分)相差6分。
マッティングリー監督は、「１回に走者を置いたピンチをうまく乗り越えた。	麦丁里教练也表示：“在第一回合，非常好地克服了危机。
が… 本年度　鎮守府カレー大会優勝は	不过 本届镇守府咖喱大赛的优胜者是
シカゴの２人目の投手ジェイソン・モットは２死１、３塁で２回にシーズン５本目の本塁打を放ったスターリング・マルテを敬遠で歩かせ、姜正浩との勝負を選んだ。	芝加哥的第二位救援投手简森•马蒂在2人出局、1、3垒有人的情况下，投出故意4坏球，把在第2局打出本赛季第二个全垒打的Starling Marte送上1垒，形成了满垒状态，他选择和姜正浩对决。
まるでまとまってない 一体指導者は何をやっとるんだ？	好像一盘散沙 球队的教练到底在干什么
それが終わったら，すぐにインハイ予選がやってくる	练习赛后马上就是高中联赛的预选赛了
